{
  "name": "Linear regression in Tensorflow, trained in WML",
  "description": "Example from https://github.com/tensorflow/models/tree/master/samples/cookbook/regression",
  "definition": {
    "code": [
      {
        "type": "code",
        "name": "linear_regression.py",
        "framework": {
          "name": "tensorflow",
          "version": "r1.8"
        },
        "connection": {
          "name": "github_url",
          "connection": { },
          "source": {
            "url": "https://github.com/tensorflow/models/blob/master/samples/cookbook/regression/linear_regression.py"
          }
        }
      },
      {
        "type": "code",
        "name": "automobile_data.py",
        "framework": {
          "name": "tensorflow",
          "version": "r1.8"
        },
        "connection": {
          "name": "github_url",
          "connection": { },
          "source": {
            "url": "https://github.com/tensorflow/models/blob/master/samples/cookbook/regression/automobile_data.py"
          }
        }
      }
    ],
    "topology": {
      "type": "linear regression"
    }
  },
  "training": {
    "datasets": [
      {
        "name": "auotmobile_data",
        "type": "training",
        "connection": {
          "name": "object_storage",
          "connection": {
            "auth_url": "https://identity.open.softlayer.com",
            "projectId": "f771e5d082e24857adb7554d15fc357c",
            "region": "dallas",
            "userId": "user_name",
            "password": "password"
          },
          "source": {
            "container": "batchjob",
            "filename": "imports-85.data",
            "fileformat": "gz",
            "inferschema": 1,
            "firstlineheader": true,
            "type": "bluemixobjectstorage"
          }
        },
        "data_preprocessing": {
          "operators": ["normalization", "scaling"],
          "noise_removers": ["filtering"]
        }
      }
    ],
    "hyperparameters": {
      "batch_size": 100,
      "train_steps": 1000,
      "price_norm_factor": 1000
    },
    "features": {
      "columns": ["curb-weight", "highway-mpg"]
    },
    "training_output": {
      "name": "object_storage",
      "connection": {
        "access_key_id": "aabbbccMhAI8BGNxuknp",
        "secret_access_key": "bbbcccMhAI8BGNxuknp",
        "endpoint_url": "https://s3-api.dal-us-geo.objectstorage.softlayer.net"
      },
      "source": {
        "bucket": "my-models",
        "key": "my-model",
        "type": "s3"
      }
    }
  }
}
