{
  "name": "myModel",
  "description": "This is my model",
  "authors": [
    {"name": "John Smith"}
  ],
  "tags": [ "wml example" ],
  "training": {
    "datasets": [
      {
        "name": "my_name",
        "type": "training",
        "connection": {
          "name": "object_storage",
          "connection": {
            "auth_url": "https://identity.open.softlayer.com",
            "projectId": "f771e5d082e24857adb7554d15fc357c",
            "region": "dallas",
            "userId": "user_name",
            "password": "password"
          },
          "source": {
            "container": "batchjob",
            "filename": "inputData.csv",
            "fileformat": "csv",
            "inferschema": 1,
            "firstlineheader": true,
            "type": "bluemixobjectstorage"
          }
        }
      }
    ],
    "training_output": {
      "name": "object_storage",
      "connection": {
        "access_key_id": "aabbbccMhAI8BGNxuknp",
        "secret_access_key": "bbbcccMhAI8BGNxuknp",
        "endpoint_url": "https://s3-api.dal-us-geo.objectstorage.softlayer.net"
      },
      "source": {
        "bucket": "my-models",
        "key": "my-model",
        "type": "s3"
      }
    }
  },
  "evaluations": [{
    "evaluation_type": "training_evaluation",
    "method": "binary",
    "metrics": [
      {
        "name": "areaUnderROC",
        "threshold": 0.9,
        "value": 0.94
      }
    ]
  }]
}
